{
  "schema_version": 1,
  "document_type": "local-rag/json-part",
  "part_id": "replace.expression_face",
  "version": 1,
  "part_type": "expression_face",
  "name": "Replace with expression/face-state delta name",
  "status": "staging",
  "aliases": [],
  "tags": ["free", "expression_face"],
  "payload": {
    "generation": {
      "positive": "replace with only expression, gaze and temporary facial-state requirements for this Part",
      "negative": "replace with only expression/face-state exclusions relevant to this Part"
    },
    "structured": {
      "application": {
        "mode": "delta",
        "preserve_unspecified": true
      },
      "gaze": null,
      "eyelids": null,
      "brows": null,
      "mouth": null,
      "temporary_face_state": [],
      "explicit_overrides": [],
      "must_not_define": [
        "identity",
        "hair",
        "body",
        "pose",
        "camera",
        "background",
        "rendering",
        "lineart"
      ]
    }
  },
  "provenance": {
    "source_type": "local-ai-learning",
    "source_ref": ""
  }
}
