{
  "schema_version": 1,
  "document_type": "local-rag/json-part",
  "part_id": "replace.background_scene",
  "version": 1,
  "part_type": "background_scene",
  "name": "Replace with background/scene delta name",
  "status": "staging",
  "aliases": [],
  "tags": ["free", "background_scene"],
  "payload": {
    "generation": {
      "positive": "replace with only location, environmental objects, time/weather and scene-light-context requirements for this Part",
      "negative": "replace with only background/scene exclusions relevant to this Part"
    },
    "structured": {
      "application": {
        "mode": "delta",
        "preserve_unspecified": true
      },
      "location": null,
      "environment_objects": [],
      "time_of_day": null,
      "weather": null,
      "scene_light_context": null,
      "explicit_overrides": [],
      "must_not_define": [
        "character_appearance",
        "outfit",
        "expression",
        "skeletal_pose",
        "camera_mechanics",
        "rendering_technique",
        "lineart"
      ]
    }
  },
  "provenance": {
    "source_type": "local-ai-learning",
    "source_ref": ""
  }
}
