{
  "schema_version": 1,
  "document_type": "local-rag/json-part",
  "part_id": "replace.character_body",
  "version": 1,
  "part_type": "character_body",
  "name": "Replace with character/body delta name",
  "status": "staging",
  "aliases": [],
  "tags": ["free", "character_body"],
  "payload": {
    "generation": {
      "positive": "replace with only the explicit physical appearance/body requirements for this Part",
      "negative": "replace with only physical appearance/body exclusions relevant to this Part"
    },
    "structured": {
      "application": {
        "mode": "delta",
        "preserve_unspecified": true
      },
      "hair": null,
      "eyes": null,
      "skin": null,
      "build": null,
      "proportions": null,
      "intrinsic_traits": [],
      "explicit_overrides": [],
      "must_not_define": [
        "outfit",
        "expression",
        "pose",
        "camera",
        "background",
        "rendering",
        "lineart"
      ]
    }
  },
  "provenance": {
    "source_type": "local-ai-learning",
    "source_ref": ""
  }
}
